Key,Item.Type,Publication.Year,Author,Title,Publication.Title,ISBN,ISSN,DOI,Url,Abstract.Note,Date,Screen,Reason,Comment,Screen.Name,,,,,,,,,,,,,,,,,,,,,,,,,,,,,,,,,,,,,,,,,,,,,,,,,,,,,,,,,,,,,,,,,,,,,,,,,,,,,,,,,,,,,,,,,,,,,,,,,,
LIZSWYQW,journalArticle,2013,"Iler, Amy M.; Hoye, Toke T.; Inouye, David W.; Schmidt, Niels M.",Nonlinear flowering responses to climate: are species approaching their limits of phenological change?,PHILOSOPHICAL TRANSACTIONS OF THE ROYAL SOCIETY B-BIOLOGICAL SCIENCES,NA,0962-8436,10.1098/rstb.2012.0489,NA,"Many alpine and subalpine plant species exhibit phenological advancements in association with earlier snowmelt. While the phenology of some plant species does not advance beyond a threshold snowmelt date, the prevalence of such threshold phenological responses within plant communities is largely unknown. We therefore examined the shape of flowering phenology responses (linear versus nonlinear) to climate using two long-term datasets from plant communities in snow-dominated environments: Gothic, CO, USA (19742011) and Zackenberg, Greenland (1996-2011). For a total of 64 species, we determined whether a linear or nonlinear regression model best explained interannual variation in flowering phenology in response to increasing temperatures and advancing snowmelt dates. The most common nonlinear trend was for species to flower earlier as snowmelt advanced, with either no change or a slower rate of change when snowmelt was early (average 20% of cases). By contrast, some species advanced their flowering at a faster rate over the warmest temperatures relative to cooler temperatures (average 5% of cases). Thus, some species seem to be approaching their limits of phenological change in response to snowmelt but not temperature. Such phenological thresholds could either be a result of minimum springtime photoperiod cues for flowering or a slower rate of adaptive change in flowering time relative to changing climatic conditions.",19/08/2013,Accept,No reason given,No comments given,Insert Screener Name,,,,,,,,,,,,,,,,,,,,,,,,,,,,,,,,,,,,,,,,,,,,,,,,,,,,,,,,,,,,,,,,,,,,,,,,,,,,,,,,,,,,,,,,,,,,,,,,,,
LIZSWYQW,journalArticle,2013,"Iler, Amy M.; Hoye, Toke T.; Inouye, David W.; Schmidt, Niels M.",Nonlinear flowering responses to climate: are species approaching their limits of phenological change?,PHILOSOPHICAL TRANSACTIONS OF THE ROYAL SOCIETY B-BIOLOGICAL SCIENCES,NA,0962-8436,10.1098/rstb.2012.0489,NA,"Many alpine and subalpine plant species exhibit phenological advancements in association with earlier snowmelt. While the phenology of some plant species does not advance beyond a threshold snowmelt date, the prevalence of such threshold phenological responses within plant communities is largely unknown. We therefore examined the shape of flowering phenology responses (linear versus nonlinear) to climate using two long-term datasets from plant communities in snow-dominated environments: Gothic, CO, USA (19742011) and Zackenberg, Greenland (1996-2011). For a total of 64 species, we determined whether a linear or nonlinear regression model best explained interannual variation in flowering phenology in response to increasing temperatures and advancing snowmelt dates. The most common nonlinear trend was for species to flower earlier as snowmelt advanced, with either no change or a slower rate of change when snowmelt was early (average 20% of cases). By contrast, some species advanced their flowering at a faster rate over the warmest temperatures relative to cooler temperatures (average 5% of cases). Thus, some species seem to be approaching their limits of phenological change in response to snowmelt but not temperature. Such phenological thresholds could either be a result of minimum springtime photoperiod cues for flowering or a slower rate of adaptive change in flowering time relative to changing climatic conditions.",19/08/2013,Accept,No reason given,No comments given,Insert Screener Name,,,,,,,,,,,,,,,,,,,,,,,,,,,,,,,,,,,,,,,,,,,,,,,,,,,,,,,,,,,,,,,,,,,,,,,,,,,,,,,,,,,,,,,,,,,,,,,,,,
2XEC698A,journalArticle,2020,"Gaira, Kailash S.; Dhar, Uppeandra",Phenological change modelling for selected Himalayan medicinal herbs using herbarium records: A case study,ECOLOGICAL INFORMATICS,NA,1574-9541,10.1016/j.ecoinf.2020.101177,NA,"Regarding the effects of warming on phenology, essentially that climate warming is advancing vegetation phenology around the globe, and case studies of specific species/regions work to gauge this impact. Thus, we attempted to demonstrate phenological patterns of selected 4 alpine/sub-alpine and 4 temperate medicinal herbs based on higher medicinal value of Indian Himalayan Region (IHR) using total 654 herbarium records and applied Generalized Additive Model (GAM) as non-normal and non-linear application. The GAM demonstrated an advancement in the flowering time for alpine/sub-alpine species (Arnebia benthamii, Meconopsis aculeata, Podophyllum hexandrum) and temperate species (Delphinium denudatum and Dioscorea deltoidea), while delayed flowering for Swertia cordata (p < 0.001). Combining the herbarium records, the model significantly projected advancement in flowering time (21-25 days) over the last 100 years only for alpine/sub-alpine species (p < 0.0001). However, the relationship between flowering time and warming winter temperature was predicted advancement in flowering time for alpine/sub-alpine species (6-10 days per 1 degrees C) and temperate species (8-11 days per 1 degrees C). The results reveal that long-term herbarium records may be considered as a useful tool for predicting the possible impact of climate change on plant phenology in the IHR using GAM approach.",2020-11,Accept,No reason given,No comments given,Insert Screener Name,,,,,,,,,,,,,,,,,,,,,,,,,,,,,,,,,,,,,,,,,,,,,,,,,,,,,,,,,,,,,,,,,,,,,,,,,,,,,,,,,,,,,,,,,,,,,,,,,,
7T8CGP2W,journalArticle,2015,"Wheeler, Helen C.; Hoye, Toke T.; Schmidt, Niels Martin; Svenning, Jens-Christian; Forchhammer, Mads C.",Phenological mismatch with abiotic conditions-implications for flowering in Arctic plants,ECOLOGY,NA,0012-9658,10.1890/14-0338.1,NA,"Although many studies have examined the phenological mismatches between interacting organisms, few have addressed the potential for mismatches between phenology and seasonal weather conditions. In the Arctic, rapid phenological changes in many taxa are occurring in association with earlier snowmelt. The timing of snowmelt is jointly affected by the size of the late winter snowpack and the temperature during the spring thaw. Increased winter snowpack results in delayed snowmelt, whereas higher air temperatures and faster snowmelt advance the timing of snowmelt. Where interannual variation in snowpack is substantial, changes in the timing of snowmelt can be largely uncoupled from changes in air temperature. Using detailed, long-term data on the flowering phenology of four arctic plant species from Zackenberg, Greenland, we investigate whether there is a phenological component to the temperature conditions experienced prior to and during flowering. In particular, we assess the role of timing of flowering in determining pre-flowering exposure to freezing temperatures and to the temperatures experienced prior to flowering. We then examine the implications of flowering phenology for flower abundance. Earlier snowmelt resulted in greater exposure to freezing conditions, suggesting an increased potential for a mismatch between the timing of flowering and seasonal weather conditions and an increased potential for negative consequences, such as freezing damage. We also found a parabolic relationship between the timing of flowering and the temperature experienced during flowering after taking interannual temperature effects into account. If timing of flowering advances to a cooler period of the growing season, this may moderate the effects of a general warming trend across years. Flower abundance was quadratically associated with the timing of flowering, such that both early and late flowering led to lower flower abundance than did intermediate flowering. Our results indicate that shifting the timing of flowering affects the temperature experienced during flower development and flowering beyond that imposed by interannual variations in climate. We also found that phenological timing may affect flower abundance, and hence, fitness. These findings suggest that plant population responses to future climate change will be shaped not only by extrinsic climate forcing, but also by species' phenological responses.",2015-03,Accept,No reason given,No comments given,Insert Screener Name,,,,,,,,,,,,,,,,,,,,,,,,,,,,,,,,,,,,,,,,,,,,,,,,,,,,,,,,,,,,,,,,,,,,,,,,,,,,,,,,,,,,,,,,,,,,,,,,,,
EVEIBMYS,journalArticle,2024,"Crepaz, Harald; Quaglia, Elena; Lombardi, Giampiero; Lonati, Michele; Rossi, Mattia; Ravetto Enri, Simone; Dullinger, Stefan; Tappeiner, Ulrike; Niedrist, Georg",Phenological responses of alpine snowbed communities to advancing snowmelt,ECOLOGY AND EVOLUTION,NA,2045-7758,10.1002/ece3.11714,NA,"Climate change is leading to advanced snowmelt date in alpine regions. Consequently, alpine plant species and ecosystems experience substantial changes due to prolonged phenological seasons, while the responses, mechanisms and implications remain widely unclear. In this 3-year study, we investigated the effects of advancing snowmelt on the phenology of alpine snowbed species. We related microclimatic drivers to species and ecosystem phenology using in situ monitoring and phenocams. We further used predictive modelling to determine whether early snowmelt sites could be used as sentinels for future conditions. Temperature during the snow-free period primarily influenced flowering phenology, followed by snowmelt timing. Salix herbacea and Gnaphalium supinum showed the most opportunistic phenology, while annual Euphrasia minima struggled to complete its phenology in short growing seasons. Phenological responses varied more between years than sites, indicating potential local long-term adaptations and suggesting these species' potential to track future earlier melting dates. Phenocams captured ecosystem-level phenology (start, peak and end of phenological season) but failed to explain species-level variance. Our findings highlight species-specific responses to advancing snowmelt, with snowbed species responding highly opportunistically to changes in snowmelt timings while following species-specific developmental programs. While species from surrounding grasslands may benefit from extended growing seasons, snowbed species may become outcompeted due to internal-clock-driven, non-opportunistic senescence, despite displaying a high level of phenological plasticity. Our study investigates the phenological responses of five typical snowbed species to advancing snowmelt using in situ monitoring, phenocam imagery and predictive modelling. Over 3 years, we found temperature to be the primary driver of phenological changes in alpine snowbeds, with varying importance of photoperiodism among species. Results suggest a potential diminishing relevance of photoperiodism in warmer conditions.image",2024-07,Accept,No reason given,No comments given,Insert Screener Name,,,,,,,,,,,,,,,,,,,,,,,,,,,,,,,,,,,,,,,,,,,,,,,,,,,,,,,,,,,,,,,,,,,,,,,,,,,,,,,,,,,,,,,,,,,,,,,,,,
4NPBUUPY,journalArticle,2015,"Rosa, Roxaneh Khorsand; Oberbauer, Steven F.; Starr, Gregory; La Puma, Inga Parker; Pop, Eric; Ahlquist, Lorraine; Baldwin, Tracey",Plant phenological responses to a long-term experimental extension of growing season and soil warming in the tussock tundra of Alaska,GLOBAL CHANGE BIOLOGY,NA,1354-1013,10.1111/gcb.13040,NA,"Climate warming is strongly altering the timing of season initiation and season length in the Arctic. Phenological activities are among the most sensitive plant responses to climate change and have important effects at all levels within the ecosystem. We tested the effects of two experimental treatments, extended growing season via snow removal and extended growing season combined with soil warming, on plant phenology in tussock tundra in Alaska from 1995 through 2003. We specifically monitored the responses of eight species, representing four growth forms: (i) graminoids (Carex bigellowii and Eriophorum vaginatum); (ii) evergreen shrubs (Ledum palustre, Cassiope tetragona, and Vaccinium vitis-idaea); (iii) deciduous shrubs (Betula nana and Salix pulchra); and (iv) forbs (Polygonum bistorta). Our study answered three questions: (i) Do experimental treatments affect the timing of leaf bud break, flowering, and leaf senescence? (ii) Are responses to treatments species-specific and growth form-specific? and (iii) Which environmental factors best predict timing of phenophases? Treatment significantly affected the timing of all three phenophases, although the two experimental treatments did not differ from each other. While phenological events began earlier in the experimental plots relative to the controls, duration of phenophases did not increase. The evergreen shrub, Cassiope tetragona, did not respond to either experimental treatment. While the other species did respond to experimental treatments, the total active period for these species did not increase relative to the control. Air temperature was consistently the best predictor of phenology. Our results imply that some evergreen shrubs (i.e., C.tetragona) will not capitalize on earlier favorable growing conditions, putting them at a competitive disadvantage relative to phenotypically plastic deciduous shrubs. Our findings also suggest that an early onset of the growing season as a result of decreased snow cover will not necessarily result in greater tundra productivity.",2015-12,Accept,No reason given,No comments given,Insert Screener Name,,,,,,,,,,,,,,,,,,,,,,,,,,,,,,,,,,,,,,,,,,,,,,,,,,,,,,,,,,,,,,,,,,,,,,,,,,,,,,,,,,,,,,,,,,,,,,,,,,
GEU7LJ4T,journalArticle,2019,"Suonan, Ji; Classen, Aimee T.; Sanders, Nathan J.; He, Jin-Sheng",Plant phenological sensitivity to climate change on the Tibetan Plateau and relative to other areas of the world,ECOSPHERE,NA,2150-8925,10.1002/ecs2.2543,NA,"Global warming and changes in precipitation are altering the phenology of plants that significantly impact the functioning and services of ecosystems. Although a number of studies have addressed responses of plant phenology to warming and altered precipitation individually, their interactions can alter plant phenology differently than either does independently. To explore how the interactions between global change drivers alter alpine ecosystems, we conducted a factorial experiment manipulating warming (ambient and +2 degrees C) and altered precipitation (50% decrease, control, and 50% increase) simultaneously in an alpine meadow on the Tibetan Plateau. Over two years, we monitored plant phenological events, leafout day and first flowering day, for 11 common plant species that account for 74.4% of the total above biomass. Surprisingly, there was no interaction between warming and changes in precipitation on community plant phenology, but warming advanced leaf-out and first flowering day by 7.10 and 9.79 d, respectively. Unlike the community response, plant functional groups had a variety of direct and interactive responses to the experimental climate drivers. While the phenology of legumes was most influenced by temperature, temperature and precipitation interacted to alter the phenology of grasses and forbs. To explore how plant phenological sensitivity on the Tibetan Plateau is compared with other meadow ecosystems, we combined our dataset with a global plant phenology dataset. Interestingly, the phenological sensitivity of leaf-out day and first flowering day on the Tibetan Plateau is 7.3 and 37.8 times greater than global phenological sensitivity, respectively. This result highlights that a meta-analysis of global phenological sensitivity may significantly underestimate change in some regions-even regions as large as the Tibetan Plateau. Together, our results suggest that the Tibetan Plateau may experience rapid change as temperatures warm and that these changes will likely be more rapid than in other regions of the world. Further, our study highlights that if we are to make accurate predictions of how plant phenology may change with warming, we need to understand the specific environmental cues that drive phenological responses across different areas.",2019-01,Accept,No reason given,No comments given,Insert Screener Name,,,,,,,,,,,,,,,,,,,,,,,,,,,,,,,,,,,,,,,,,,,,,,,,,,,,,,,,,,,,,,,,,,,,,,,,,,,,,,,,,,,,,,,,,,,,,,,,,,
PLERDUJA,journalArticle,2014,"Lessard-Therrien, Malie; Bolmgren, Kjell; Davies, T. Jonathan",Predicting flowering phenology in a subarctic plant community,BOTANY,NA,1916-2790,10.1139/cjb-2014-0026,NA,"Phenological studies are rarely reported from arctic and subarctic regions, but are essential to evaluate species' response to climate change in these rapidly warming ecosystems. Here, we present a phylogenetic analysis of flowering phenology across an elevational gradient in the Canadian subarctic. We found that the timing of first flower was best explained by a combination of snowmelt, elevation, and growing degree-days. We also show that early flowering species have demonstrated lower intraspecific variability in their response to climate cues in comparison with late flowering species, such that individual flowering times of early species are more closely tied to environmental predictors. Previous work has suggested that early flowering species are more variable in their phenology. However, these studies have mostly examined variation in phenology over time, whereas we examined variation in phenology over space. We suggest that both patterns can be explained by the tighter coupling between phenology and climate cues for early flowering species. Thus, early flowering species have low intraspecific variance in flowering times within a single growing season as individuals respond more uniformly to a common set of cues in comparison with late flowering species. However, these same species may show large variance between years reflecting interannual variation in climate.",2014-10,Accept,No reason given,No comments given,Insert Screener Name,,,,,,,,,,,,,,,,,,,,,,,,,,,,,,,,,,,,,,,,,,,,,,,,,,,,,,,,,,,,,,,,,,,,,,,,,,,,,,,,,,,,,,,,,,,,,,,,,,
958HKBUZ,journalArticle,2017,"Panchen, Zoe A.; Gorelick, Root",Prediction of Arctic plant phenological sensitivity to climate change from historical records,ECOLOGY AND EVOLUTION,NA,2045-7758,10.1002/ece3.2702,NA,"The pace of climate change in the Arctic is dramatic, with temperatures rising at a rate double the global average. The timing of flowering and fruiting (phenology) is often temperature dependent and tends to advance as the climate warms. Herbarium specimens, photographs, and field observations can provide historical phenology records and have been used, on a localised scale, to predict species' phenological sensitivity to climate change. Conducting similar localised studies in the Canadian Arctic, however, poses a challenge where the collection of herbarium specimens, photographs, and field observations have been temporally and spatially sporadic. We used flowering and seed dispersal times of 23 Arctic species from herbarium specimens, photographs, and field observations collected from across the 2.1million km(2) area of Nunavut, Canada, to determine (1) which monthly temperatures influence flowering and seed dispersal times; (2) species' phenological sensitivity to temperature; and (3) whether flowering or seed dispersal times have advanced over the past 120years. We tested this at different spatial scales and compared the sensitivity in different regions of Nunavut. Broadly speaking, this research serves as a proof of concept to assess whether phenology-climate change studies using historic data can be conducted at large spatial scales. Flowering times and seed dispersal time were most strongly correlated with June and July temperatures, respectively. Seed dispersal times have advanced at double the rate of flowering times over the past 120years, reflecting greater late-summer temperature rises in Nunavut. There is great diversity in the flowering time sensitivity to temperature of Arctic plant species, suggesting climate change implications for Arctic ecological communities, including altered community composition, competition, and pollinator interactions. Intraspecific temperature sensitivity and warming trends varied markedly across Nunavut and could result in greater changes in some parts of Nunavut than in others.",2017-03,Accept,No reason given,No comments given,Insert Screener Name,,,,,,,,,,,,,,,,,,,,,,,,,,,,,,,,,,,,,,,,,,,,,,,,,,,,,,,,,,,,,,,,,,,,,,,,,,,,,,,,,,,,,,,,,,,,,,,,,,
MAG3Q45X,journalArticle,1997,"Alatalo, JM; Totland, O","Response to simulated climatic change in an alpine and subarctic pollen-risk strategist, Silene acaulis",GLOBAL CHANGE BIOLOGY,NA,1354-1013,10.1111/j.1365-2486.1997.gcb133.x,NA,"The aim of this study was to test if early no overing species respond with increased seed production to climate warming as is predicted for late-flowering seed-risk strategists. Experimental climate warming of about 3 degrees C was applied to two populations of the cushion-forming plant Silene acaulis (L.) Jacq. The experiment was run at one subarctic site and one alpine site for 2 years and 1 year, respectively, using open-top chambers (OTC). The 2-year temperature enhancement at the subarctic site had a marked effect on the flowering phenology. Cushions inside the OTC started flowering substantially earlier than control cushions. Both the male and female phases developed faster in the OTCs, and maturation of capsules occurred earlier. The cushions also responded positively in reproductive terms and produced more mature seeds and had a higher seed/ovule ratio. After 1 year temperature enhancement at the alpine site there was a weak trend for earlier flowering, but there was no significant difference in seed production or seed/ovule ratio.",1997-12,Accept,No reason given,No comments given,Insert Screener Name,,,,,,,,,,,,,,,,,,,,,,,,,,,,,,,,,,,,,,,,,,,,,,,,,,,,,,,,,,,,,,,,,,,,,,,,,,,,,,,,,,,,,,,,,,,,,,,,,,
WI7A4B6H,journalArticle,2017,"Blume-Werry, Gesche; Jansson, Roland; Milbau, Ann",Root phenology unresponsive to earlier snowmelt despite advanced above-ground phenology in two subarctic plant communities,FUNCTIONAL ECOLOGY,NA,0269-8463,10.1111/1365-2435.12853,NA,"1. Earlier snowmelt at high latitudes advances above-ground plant phenology, thereby affecting water, nutrient and carbon cycles. Despite the key role of fine roots in these ecosystem processes, phenological responses to earlier snowmelt have never been assessed below-ground. 2. We experimentally advanced snowmelt in two contrasting plant community types (heath and meadow) in northern Sweden and measured above- and below-ground phenology (leaf-out, flowering and fine root growth). We expected earlier snowmelt to advance both above- and below-ground phenology, and shrub-dominated heath to be more responsive than meadow. 3. Snow melted on average 9 days earlier in the manipulated plots than in controls, and soil temperatures were on average 0.9 degrees C higher during the snowmelt period of 3 weeks. This resulted in small advances in above-ground phenology, but contrary to our expectations, root phenology was unresponsive, with root growth generally starting before leaf-out. These responses to the snowmelt treatment were similar in both plant community types, despite strong differences in dominating plant functional types and root properties, such as root length and turnover. 4. The lack of a response in root phenology, despite warmer soil temperatures and above-ground phenological advances, adds evidence that above-ground plant responses might not be directly translated to below-ground plant responses, and that our understanding of factors driving below-ground phenology is still limited, although of major importance for water, nutrient and carbon cycling.",2017-07,Accept,No reason given,No comments given,Insert Screener Name,,,,,,,,,,,,,,,,,,,,,,,,,,,,,,,,,,,,,,,,,,,,,,,,,,,,,,,,,,,,,,,,,,,,,,,,,,,,,,,,,,,,,,,,,,,,,,,,,,
