Key,Item.Type,Publication.Year,Author,Title,Publication.Title,ISBN,ISSN,DOI,Url,Abstract.Note,Date,Date.Added,Date.Modified,Access.Date,Pages,Num.Pages,Issue,Volume,Number.Of.Volumes,Journal.Abbreviation,Short.Title,Series,Series.Number,Series.Text,Series.Title,Publisher,Place,Language,Rights,Type,Archive,Archive.Location,Library.Catalog,Call.Number,Extra,Notes,File.Attachments,Link.Attachments,Manual.Tags,Automatic.Tags,Editor,Series.Editor,Translator,Contributor,Attorney.Agent,Book.Author,Cast.Member,Commenter,Composer,Cosponsor,Counsel,Interviewer,Producer,Recipient,Reviewed.Author,Scriptwriter,Words.By,Guest,Number,Edition,Running.Time,Scale,Medium,Artwork.Size,Filing.Date,Application.Number,Assignee,Issuing.Authority,Country,Meeting.Name,Conference.Name,Court,References,Reporter,Legal.Status,Priority.Numbers,Programming.Language,Version,System,Code,Code.Number,Section,Session,Committee,History,Legislative.Body
DRUAGWXC,conferencePaper,2018,"Cho, A.; Chen, N.; Paull, R. E.",Modification of production systems for year-round marketing,INTERNATIONAL SYMPOSIA ON TROPICAL AND TEMPERATE HORTICULTURE - ISTTH2016,978-94-6261-200-6,,10.17660/ActaHortic.2018.1205.21,,"The fruit production in the tropics offers a greater scope to modify a plant's flowering and fruiting cycles than in temperate areas. Changing the normal seasonal flowering cycle offers growers considerable economic advantages, by enhancing the ability to market tropical fruit in the off-season. A grower can cycle different blocks of trees to provide continuous employment for workers, schedule production to avoid the peak periods when gluts occur and often the price is less than the production costs, and can accept orders to deliver fruit at a future date. The practices used to modify the timing of flowering also offers the opportunity to improve product quality and reduced cull losses when coupled with practices such as fruit thinning and bagging. Cold temperatures and photoperiodism determine flower induction in temperate, and subtropical growing areas. The cold season in the subtropics often leads mango, for example, to have only one flowering cycle per year, whereas in the tropics, it might flower two to three times per year. The phenology of many tropical fruit crops and some temperate crops when grown in the tropics can be modified by production practices such as the fertilization and irrigation, pruning and chemical treatments. However, differences occur in the varietal responses to these modified practices. The classic example of a change in the seasonal timing of flowering is pineapple, after it was observed that smoke induced off-season flowering in this photoperiodic species. Water stress and fertilization timing frequently play a significant role in modifying seasonal flowering patterns in tropical species, as does girdling, shading, roots pruning and chemical treatments to stimulate and inhibit growth. Plant growth regulators and inhibitors are used to hasten the completion of the natural phenological vegetative and root growth phases and prepare the tree for flowering. The modification of the natural phenological cycles has raised concerns by some orchardists and researchers that the tree's useful life might be reduced. The reduction in a tree's productive life due to cycling can incur additional expenses to replant and wait for the new planting to mature and produce fruit. It would be necessary to balance the cost of replanting, if needed, with the advantages from cycling trees to achieve higher fruit prices. Examples of crops where flowering and fruiting cycles have been modified, include; carambola, durian, grape, guava, longan, mango, pineapple, rambutan, sweetsop and wax apple. The potential also exists to tailor production practices in other tropical fruit crops to allow year-round marketing of high quality tropical fruit.",2018,02/03/2025 20:24,02/03/2025 20:24,,191-201,,,1205,,,,Acta Horticulturae,,,,INT SOC HORTICULTURAL SCIENCE,"PO BOX 500, 3001 LEUVEN 1, BELGIUM",English,,,,,,,Backup Publisher: Int Soc Horticultural Sci ISSN: 0567-7572 Type: Proceedings Paper,,,,flowering; phenology; flower induction; marketing; tropical fruit,,"Drew, R",,,,,,,,,,,,,,,,,,,,,,,,,,,,,,,,,,,,,,,,,,,,,
DAHE4F5C,journalArticle,2007,"Selwyn, M. Arthur; Parthasarathy, N.","Fruiting phenology in a tropical dry evergreen forest on the Coromandel coast of India in relation to plant life-forms, physiognomic groups, dispersal modes, and climatic constraints",FLORA,,0367-2530,10.1016/j.flora.2007.04.001,,"The fruiting phenology of 22 woody plant species belonging to 19 families was studied with respect to life-forms, physiognomic groups and dispersal modes, for I year at monthly intervals, in a tropical dry evergreen forest at Oorani (12 degrees 11'N, 79 degrees 57'E) on the Coromandel coast of India. At the community level, bimodal fruiting pattern prevailed, with a major peak in the dry season and a minor one in the early rainy season. An annual fruiting pattern was observed in many species and among the studied species fruiting lasted for 2-9 months. There was no significant difference in the frequency of species at three fruiting stages across the life-form categories and many species of upper and lower canopy trees and lianas were in the ripe fruiting phase during the late dry season. Plant physiognomic groups displayed distinct seasonality in fruiting pattern. The fruit maturation period was much longer for the wet season fruiting brevideciduous species than evergreen and deciduous species that fruited during the dry season. The variation in timing of fruiting behaviour among zoochorous species demonstrated less seasonality and zoochorous fruits were available throughout the year. Fruiting in anemochorous species peaked during the driest months and dryness favoured the dissemination of seeds. The fruiting patterns observed in the studied tropical dry evergreen forest across various plant traits were comparable with patterns recorded in other tropical seasonal forests. (c) 2007 Elsevier GmbH. All rights reserved.",2007,02/03/2025 20:24,02/03/2025 20:24,,371-382,,5,202,,,,,,,,,,English,,,,,,,"Place: HACKERBRUCKE 6, 80335 MUNICH, GERMANY Publisher: ELSEVIER GMBH Type: Article",,,,life-forms; tropical dry evergreen forest; climate; fruiting phenology; dispersal modes; physiognomic groups,,,,,,,,,,,,,,,,,,,,,,,,,,,,,,,,,,,,,,,,,,,,,,,
AGQZEL8G,journalArticle,2000,"Morellato, LPC; Talora, DC; Takahasi, A; Bencke, CC; Romera, EC; Zipparro, VB",Phenology of Atlantic rain forest trees: A comparative study,BIOTROPICA,,0006-3606,10.1111/j.1744-7429.2000.tb00620.x,,"This paper describes the phenology of leaf, flower, and fruit phenology in the Atlantic rain forests of southeastern Brazil. For 17 months, we observed the phenological patterns of trees from two Atlantic forest types at four sites: premontane forest (Sites I and IV; the “typical” Atlantic rain forest) and coastal plain forest (Sites II and III). All sites experience a nonseasonal, tropical wet climate, characterized by an annual rainfall usually > 2000 mm and lacking a dry season. We tested for the occurrence (or absence) of seasonal phenological patterns within each site and compared the patterns detected among the four different forest sites using circular statistics. The expected weakly seasonal phenological patterns were not observed for these forests. Flowering and leaf flush patterns of Atlantic rain forest trees were significantly seasonal, concentrated at the beginning of the wettest season, and were significantly correlated with day length and temperature. These results stress the influence that seasonal variation in day length has on ever-wet forest tree phenology. Fruiting phenologies were aseasonal in all four forests. Flowering patterns did not differ significantly among three of the four forest sites analyzed, suggesting the occurrence of a general flowering pattern for Atlantic rain forest trees.",2000,02/03/2025 20:24,02/03/2025 20:24,,811-823,,"4B, SI",32,,,,,,,,,,English,,,,,,,"Place: 810 EAST 10TH ST, LAWRENCE, KS 66044 USA Publisher: ASSOC TROPICAL BIOLOGY INC Type: Article",,,,seasonality; flowering; tropical forest; fruiting; phenology; Atlantic Forest; Brazil; leaf fall; leaf flush,,,,,,,,,,,,,,,,,,,,,,,,,,,,,,,,,,,,,,,,,,,,,,,
MJBA9URL,journalArticle,1992,"BHAT, DM","PHENOLOGY OF TREE SPECIES OF TROPICAL MOIST FOREST OF UTTARA-KANNADA DISTRICT, KARNATAKA, INDIA",JOURNAL OF BIOSCIENCES,,0250-5991,10.1007/BF02703158,,"Phenological observations on tree species in tropical moist forest of Uttara Kannada district (13-degrees-55' to 15-degrees-31' N lat; 74-degrees-9' to 75-degrees-10' E long) during the years 1983-1985 revealed that there exists a strong seasonality for leaf flush, leaf drop and reproduction. Young leaves were produced in the pre-monsoon dry period with a peak in February, followed by the expansion of leaves which was completed in March. Abscission of leaves occurred in the post-monsoon winter period with a peak in December. There were two peaks for flowering (December and March), while fruit ripening had a single peak in May-June, preceding the monsoon rainfall. The duration of maturation of leaves was the shortest, while that of full ripening of fruits was the longest. Mature flowers of evergreen species lasted longer than those of deciduous species; in contrast the phenophase of ripe fruits of deciduous species was longer than that of evergreen species.",1992-09,02/03/2025 20:24,02/03/2025 20:24,,325-352,,3,17,,,,,,,,,,English,,,,,,,"Place: P B 8005 C V RAMAN AVENUE, BANGALORE 560 080, INDIA Publisher: INDIAN ACADEMY SCIENCES Type: Article",,,,PHENOLOGY; TREE SPECIES; TROPICAL MOIST FOREST; WESTERN GHATS,,,,,,,,,,,,,,,,,,,,,,,,,,,,,,,,,,,,,,,,,,,,,,,
XDRF94RQ,journalArticle,2006,"Bendix, J.; Homeier, J.; Ortiz, E. Cueva; Emck, P.; Breckle, S. -W.; Richter, M.; Beck, E.",Seasonality of weather and tree phenology in a tropical evergreen mountain rain forest,INTERNATIONAL JOURNAL OF BIOMETEOROLOGY,,0020-7128,10.1007/s00484-006-0029-8,,"Flowering and fruiting as phenological events of 12 tree species in an evergreen tropical mountain rain forest in southern Ecuador were examined over a period of 3-4 years. Leaf shedding of two species was observed for 12 months. Parallel to the phenological recordings, meteorological parameters were monitored in detail and related to the flowering and fruiting activity of the trees. In spite of the perhumid climate of that area, a high degree of intra- and inter-specific synchronisation of phenological traits was apparent. With the exception of one species that flowered more or less continuously, two groups of trees could be observed, one of which flowered during the less humid months (September to October) while the second group started to initiate flowers towards the end of that phase and flowered during the heavy rains (April to July). As reflected by correlation coefficients, the all-time series of meteorological parameters showed a distinct seasonality of 8-12 months, apparently following the quasi-periodic oscillation of precipitation and related cloudiness. As revealed by power spectrum analysis and Markov persistence, rainfall and minimum temperature appear to be the only parameters with a periodicity free of long-term variations. The phenological events of most of the plant species showed a similar periodicity of 8-12 months, which followed the annual oscillation of relatively less and more humid periods and thus was in phase or in counter-phase with the oscillations of the meteorological parameters. Periods of unusual cold or dryness, presumably resulting from underlying longer-term trends or oscillations (such as ENSO), affected the homogeneity of quasi-12-month flowering events, fruit maturation and also the production of germinable seeds. Some species show underlying quasi-2-year-oscillations, for example that synchronise with the development of air temperature; others reveal an underlying decrease or increase in flowering activity over the observation period, influenced for instance by solar irradiance. As Ecuador suffers the highest rate of deforestation in South America, there is an urgent need for indigenous plant material for reforestation. A detailed knowledge of the biology of reproduction in relation to governing external factors (mainly climate) is thus required.",2006-07,02/03/2025 20:24,02/03/2025 20:24,,370-384,,6,50,,,,,,,,,,English,,,,,,,"Place: 233 SPRING STREET, NEW YORK, NY 10013 USA Publisher: SPRINGER Type: Article",,,,phenology; Ecuador; mountain forest; tropical; weather cycles,,,,,,,,,,,,,,,,,,,,,,,,,,,,,,,,,,,,,,,,,,,,,,,
DCF47JIL,journalArticle,2004,"Kudo, G; Suzuki, S","Flowering phenology of tropical-alpine dwarf trees on Mount Kinabalu, Borneo",JOURNAL OF TROPICAL ECOLOGY,,0266-4674,10.1017/S0266467404001841,,"The flowering phenology of five alpine dwarf-tree species was observed in the summit region (3900-3950 m elevation) of Mt. Kinabalu on Borneo Island from March.1.998 to November 2001. For each target species, 20-50 individual plants were numbered in two observation plots and the number of inflorescences was monitored at 23-mo intervals. The flowering patterns varied among species. Rhododendron buxifolium bloomed extensively every March-May at the main plot but the flowering pattern at the subplot was less predictable. Mass flowering occurred in March 1998 when drought stress was very severe due to an El Nino event. Rhododendron ericoides showed continuous flowering throughout the year and high synchrony between the plots. Extensive flowering of Leptospermum recurvuin occurred synchronously within and between plots in the early half of 1999, then flowering activity decreased greatly. Photinia davidiana showed an annual flowering cycle but the timing of the peak flowering differed between the plots. Vaccinium stapfianum showed synchronous flowering between the plots and the flowering peak appeared at longer than 1-y intervals. Plant size was positively correlated with mean flower production in all species, and with the flowering frequency of R. ericoides, R. buxifoilium, and V. stapfianum at one of the plots at least. Two fleshy-fruited species, P. davidiana and V. stapfianum, had high selfing ability for fruit production and showed relatively low flowering synchrony among individuals in comparison with the other species. These results indicate that the trigger for initiation of flowering may differ among sympatric species in a tropical-alpine ecosystem at least in normal years.",2004-09,02/03/2025 20:24,02/03/2025 20:24,,563-571,,5,20,,,,,,,,,,English,,,,,,,"Place: 32 AVENUE OF THE AMERICAS, NEW YORK, NY 10013-2473 USA Publisher: CAMBRIDGE UNIV PRESS Type: Article",,,,flowering synchrony; fruit set; Leptospermum; Photinia; Rhododendron; selling ability; Vaccinium,,,,,,,,,,,,,,,,,,,,,,,,,,,,,,,,,,,,,,,,,,,,,,,
YXI893LE,journalArticle,2011,"Staggemeier, Vanessa Graziele; Cerdeira Morellato, Leonor Patricia",Reproductive phenology of coastal plain Atlantic forest vegetation: comparisons from seashore to foothills,INTERNATIONAL JOURNAL OF BIOMETEOROLOGY,,0020-7128,10.1007/s00484-011-0482-x,,"The diversity of tropical forest plant phenology has called the attention of researchers for a long time. We continue investigating the factors that drive phenological diversity on a wide scale, but we are unaware of the variation of plant reproductive phenology at a fine spatial scale despite the high spatial variation in species composition and abundance in tropical rainforests. We addressed fine scale variability by investigating the reproductive phenology of three contiguous vegetations across the Atlantic rainforest coastal plain in Southeastern Brazil. We asked whether the vegetations differed in composition and abundance of species, the microenvironmental conditions and the reproductive phenology, and how their phenology is related to regional and local microenvironmental factors. The study was conducted from September 2007 to August 2009 at three contiguous sites: (1) seashore dominated by scrub vegetation, (2) intermediary covered by restinga forest and (3) foothills covered by restinga pre-montane transitional forest. We conducted the microenvironmental, plant and phenological survey within 30 transects of 25 mx4 m (10 per site). We detected significant differences in floristic, microenvironment and reproductive phenology among the three vegetations. The microenvironment determines the spatial diversity observed in the structure and composition of the flora, which in turn determines the distinctive flowering and fruiting peaks of each vegetation (phenological diversity). There was an exchange of species providing flowers and fruits across the vegetation complex. We conclude that plant reproductive patterns as described in most phenological studies (without concern about the microenvironmental variation) may conceal the fine scale temporal phenological diversity of highly diverse tropical vegetation. This phenological diversity should be taken into account when generating sensor-derived phenologies and when trying to understand tropical vegetation responses to environmental changes.",2011-11,02/03/2025 20:24,02/03/2025 20:24,,843-854,,6,55,,,,,,,,,,English,,,,,,,"Place: 233 SPRING ST, NEW YORK, NY 10013 USA Publisher: SPRINGER Type: Article; Proceedings Paper",,,,Seasonality; Microenvironmental factors; Phenological diversity; Resource availability; Tropical forest,,,,,,,,,,,,,,,,,,,,,,,,,,,,,,,,,,,,,,,,,,,,,,,
LR435EDY,journalArticle,2018,"Suresh, H. S.; Sukumar, R.","Phenology of <i>Ficus</i> spp. in a tropical dry forest, Mudumalai, south India",JOURNAL OF FORESTRY RESEARCH,,1007-662X,10.1007/s11676-017-0513-5,,"The phenology of figs (Ficus spp. Moraceae) is being monitored in the dry forests of Mudumalai, southern India and individuals belonging to the genus are marked with unique tag numbers and their vegetative and reproductive phenologies have been monitored since August 2000 on a monthly basis. The influence of abiotic factors on fig phenology and the differences between fig and non-fig phenologies are being examined. The seasonality of different phenophases of fig phenology is also being examined. The maximum intensity of leaf flush occurred in drier months. Fig and non-fig species showed significant differences with expansion and senescence phenophases of leafing. Flowering also occurred in drier months. There were significant differences between fig and non-fig species with reproductive phenophases. As with non-fig species, leafing was influenced by maximum temperatures. Both vegetative and reproductive phenophases were significantly seasonal.",2018-07,02/03/2025 20:24,02/03/2025 20:24,,1129-1138,,4,29,,,,,,,,,,English,,,,,,,"Place: NO 26 HEXING RD, XIANGFANG DISTRICT, HARBIN, 150040, PEOPLES R CHINA Publisher: NORTHEAST FORESTRY UNIV Type: Article",,,,Seasonality; Phenology; Dry forests; Figs; Multiple regression; Non-figs,,,,,,,,,,,,,,,,,,,,,,,,,,,,,,,,,,,,,,,,,,,,,,,
XKPL2F9C,journalArticle,2007,"de Medeiros, Daniel Portela Wanderley; Lopes, Ariadna Valentina; Zickel, Carmen Silvia","Phenology of woody species in tropical coastal vegetation, northeastern Brazil",FLORA,,0367-2530,10.1016/j.flora.2006.11.002,,"The study was carried out in the Private Nature Reservation Nossa Senhora do Outeiro de Maracaipe, located along the southern coast of Pernambuco state, in the Nossa Senhora do O District (08 degrees'31'48 `' S and 35 degrees 01'05 `' W), Ipojuca municipality, northeastern Brazil. The reserve has 76.20 ha of tropical coastal vegetation (Restinga forest). The aims were to determine the existence of seasonal phenological pattern of woody species as a function of rainfall. During the Study period, the rainfall was 26.8 mm in the driest month (November 2003) and 538.9 in the wettest (June 2004). Observations on flowering, fruiting, leaf fall, and leaf flushing were recorded monthly, during 16 months (April 2003 to July 2004). All species with a ground level perimeter > 10 cm and represented by at least three individuals, were selected and tagged. A total of 51 species represented by 156 individuals were recorded. Leaf flushing and leaf fall did not have seasonal variation and the species continued to gain and loose leaves during the dry (August to February) and rainy (March to July) seasons. Flowering, when evaluated by the Fournier's percentage, varied between 1.9% and 20.2%, with maximum intensity in December 2003 (16.4%) and January 2004 (20.2%). Likewise, fruiting varied between 3.8% and 21.4% with the highest percentages in February (17.2%) and March (21.4%) 2004. The analysis comparing reproductive phenological patterns with monthly rainfall did not show a significant correlation, which may suggest investigations concerning other factors, including biotic ones, as pollination and/or dispersal modes, which can be influencing reproductive events of plants in the studied Restinga forest. (c) 2007 Elsevier GmbH. All rights reserved.",2007,02/03/2025 20:24,02/03/2025 20:24,,513-520,,7,202,,,,,,,,,,English,,,,,,,"Place: HACKERBRUCKE 6, 80335 MUNICH, GERMANY Publisher: ELSEVIER GMBH Type: Article",,,,seasonality; phenology; northeastern Brazil; restinga vegetation; tropical coastal vegetation,,,,,,,,,,,,,,,,,,,,,,,,,,,,,,,,,,,,,,,,,,,,,,,
2QC7PL6N,journalArticle,2000,"Adler, GH; Kielpinski, KA","Reproductive phenology of a tropical canopy tree, <i>Spondias mombin</i>",BIOTROPICA,,0006-3606,10.1646/0006-3606(2000)032[0686:RPOATC]2.0.CO;2,,"We studied the reproductive phenology of isolated populations of Spondias mombin to determine the degree of flowering and fruiting synchrony among populations and to examine spacial and temporal variability in fruit production. The study was conducted on six small islands (1.8-3.5 ha) in the Panama Canal. All individuals (10 cm in diameter at breast height (DBH) were marked in 1991 and censused each year through 1994 to record recruits and deaths. All marked trees were censused monthly for flowering and fruiting activity from April 1992 through December 1995. Spondias mombin was seasonal and highly synchronous in flower and fruit production among islands and across years. Proportions of individuals fruiting varied among islands, years, and tree size classes. There was a positive relationship between probability of fruit production and tree size. Synchronous reproductive activity in S. mombin probably was due to responses to proximate environmental cues such as fluctuations in irradiance, but other factors must have been responsible for temporal and spatial variation in reproductive performance. We suggest that this variation may have been due partly to temporal and spatial differences in pollinator abundance.",2000-12,02/03/2025 20:24,02/03/2025 20:24,,686-692,,4,32,,,,,,,,,,English,,,,,,,"Place: 810 EAST 10TH ST, LAWRENCE, KS 66044 USA Publisher: ASSOC TROPICAL BIOLOGY INC Type: Article",,,,flowering; fruiting; phenology; reproduction; islands; Panama; Spondias mombin,,,,,,,,,,,,,,,,,,,,,,,,,,,,,,,,,,,,,,,,,,,,,,,
LKE3XKR4,journalArticle,2018,"Adamescu, Gabriela S.; Plumptre, Andrew J.; Abernethy, Katharine A.; Polansky, Leo; Bush, Emma R.; Chapman, Colin A.; Shoo, Luke P.; Fayolle, Adeline; Janmaat, Karline R. L.; Robbins, Martha M.; Ndangalasi, Henry J.; Cordeiro, Norbert J.; Gilby, Ian C.; Wittig, Roman M.; Breuer, Thomas; Hockemba, Mireille Breuer-Ndoundou; Sanz, Crickette M.; Morgan, David B.; Pusey, Anne E.; Mugerwa, Badru; Gilagiza, Baraka; Tutin, Caroline; Ewango, Corneille E. N.; Sheil, Douglas; Dimoto, Edmond; Baya, Fidele; Bujo, Flort; Ssali, Fredrick; Dikangadissi, Jean-Thoussaint; Jeffery, Kathryn; Valenta, Kim; White, Lee; Masozera, Michel; Wilson, Michael L.; Bitariho, Robert; Ebika, Sydney T. Ndolo; Gourlet-Fleury, Sylvie; Mulindahabi, Felix; Beale, Colin M.",Annual cycles are the most common reproductive strategy in African tropical tree communities,BIOTROPICA,,0006-3606,10.1111/btp.12561,,"We present the first cross-continental comparison of the flowering and fruiting phenology of tropical forests across Africa. Flowering events of 5446 trees from 196 species across 12 sites and fruiting events of 4595 trees from 191 species across 11 sites were monitored over periods of 6 to 29years and analyzed to describe phenology at the continental level. To study phenology, we used Fourier analysis to identify the dominant cycles of flowering and fruiting for each individual tree and we identified the time of year African trees bloom and bear fruit and their relationship to local seasonality. Reproductive strategies were diverse, and no single regular cycle was found in >50% of individuals across all 12 sites. Additionally, we found annual flowering and fruiting cycles to be the most common. Sub-annual cycles were the next most common for flowering, whereas supra-annual patterns were the next most common for fruiting. We also identify variation in different subsets of species, with species exhibiting mainly annual cycles most common in West and West Central African tropical forests, while more species at sites in East Central and East African forests showed cycles ranging from sub-annual to supra-annual. Despite many trees showing strong seasonality, at most sites some flowering and fruiting occurred all year round. Environmental factors with annual cycles are likely to be important drivers of seasonal periodicity in trees across Africa, but proximate triggers are unlikely to be constant across the continent.",2018-05,02/03/2025 20:24,02/03/2025 20:24,,418-430,,3,50,,,,,,,,,,English,,,,,,,"Place: 111 RIVER ST, HOBOKEN 07030-5774, NJ USA Publisher: WILEY Type: Article",,,,seasonality; tropical forest; phenology; Africa; annual cycles; flowers; fruits,,,,,,,,,,,,,,,,,,,,,,,,,,,,,,,,,,,,,,,,,,,,,,,
