Key,Item.Type,Publication.Year,Author,Title,Publication.Title,ISBN,ISSN,DOI,Url,Abstract.Note,Date,Date.Added,Date.Modified,Access.Date,Pages,Num.Pages,Issue,Volume,Number.Of.Volumes,Journal.Abbreviation,Short.Title,Series,Series.Number,Series.Text,Series.Title,Publisher,Place,Language,Rights,Type,Archive,Archive.Location,Library.Catalog,Call.Number,Extra,Notes,File.Attachments,Link.Attachments,Manual.Tags,Automatic.Tags,Editor,Series.Editor,Translator,Contributor,Attorney.Agent,Book.Author,Cast.Member,Commenter,Composer,Cosponsor,Counsel,Interviewer,Producer,Recipient,Reviewed.Author,Scriptwriter,Words.By,Guest,Number,Edition,Running.Time,Scale,Medium,Artwork.Size,Filing.Date,Application.Number,Assignee,Issuing.Authority,Country,Meeting.Name,Conference.Name,Court,References,Reporter,Legal.Status,Priority.Numbers,Programming.Language,Version,System,Code,Code.Number,Section,Session,Committee,History,Legislative.Body
W5Q8Q72E,journalArticle,1982,"REICH, PB; BORCHERT, R","PHENOLOGY AND ECOPHYSIOLOGY OF THE TROPICAL TREE, TABEBUIA-NEOCHRYSANTHA (BIGNONIACEAE)",ECOLOGY,,0012-9658,10.2307/1938945,,"Phenology and seasonal variations in water stress, as reflected in variations in stem circumference, were monitored throughout 1978 in numerous T. neochrysantha growing at several dry and wet sites in a lowland deciduous forest in Guanacaste, Costa Rica. The rate of leaf fall during the early dry season was strongly correlated with the decline in soil moisture and increasing water stress of the tress. Without exception, recovery from water stress was required for flowering and shoot emergence. At dry sites rehydration occurred only after isolated rain showers or irrigation; at wet sites it took place during continued drought, probably as a consequence of the decrease in transpiration during leaf fall. Flowering was observed to occur at any time between the beginning (Dec.) and end (May) of the dry season. Differences in the timing and intensity of flowering as well as in the timing of leaf fall and shoot emergence can be accounted for by site-dependent differences in the rates of desiccation and rehydration of trees in conjunction with year-to-year variation in the timing and intensity of rainfall. No evidence for the control of seasonal development by other environmental factors, such as variations in temperature or photoperiod, was obtained.",1982,02/03/2025 20:24,02/03/2025 20:24,,294-299,,2,63,,,,,,,,,,English,,,,,,,"Place: 111 RIVER ST, HOBOKEN 07030-5774, NJ USA Publisher: WILEY Type: Article",,,,,,,,,,,,,,,,,,,,,,,,,,,,,,,,,,,,,,,,,,,,,,,,,,,
Y6L9FT46,journalArticle,2021,"Mohanta, Manas R.; Mohanty, Rama C.; Sahu, Sudam C.",Phenology and regeneration status of <i>Terminalia tomentosa</i> (Roxb.) Wight & Arn.: a tropical tree species of Indian forests,ECOSCIENCE,,1195-6860,10.1080/11956860.2021.1916216,,"Terminalia tomentosa (Roxb.) Wight & Arn., an important tree species in the tropical forests of India, is often reported to have poor or no regeneration in many parts of the country. The present study was conducted to evaluate the population structure and regeneration status of the species in three different forest types of the Similipal Biosphere Reserve, along with phenological behaviours for two consecutive years. Leaf initiation was positively correlated with fruit senescence (r = 0.76, p < 0.01) and flower initiation (r = 0.63, p < 0.01). However, a negative correlation was found between leaf initiation (LF2) and leaf senescence (LF5) (r = -0.42, p < 0.05). Principal Component Analysis showed that maximum temperature and rainfall in a given month are the main factors for pre-monsoon events (leaf senescence and fruit senescence) and post-monsoon events (growth and maturation of leaves and fruits). The results also revealed that regeneration failure of T. tomentosa was not due to phenological intensity but possibly to wrong phenological timing of fruit maturation. This study on regeneration status and phenological information of T. tomentosa could help develop strategies for conservation and management of this tropical tree species in its natural ecosystem.",03/04/2021,02/03/2025 20:24,02/03/2025 20:24,,171-183,,2,28,,,,,,,,,,English,,,,,,,"Place: 530 WALNUT STREET, STE 850, PHILADELPHIA, PA 19106 USA Publisher: TAYLOR & FRANCIS INC Type: Article",,,,climatic variables; phenology; PCA; Regeneration status; Terminalia tomentosa,,,,,,,,,,,,,,,,,,,,,,,,,,,,,,,,,,,,,,,,,,,,,,,
6VJR964P,journalArticle,2023,"Shin, Nagai; Katsumata, Chifuyu; Miura, Tomoaki; Tsutsumida, Narumasa; Ichie, Tomoaki; Kotani, Ayumi; Nakagawa, Michiko; Khoon, Kho Lip; Kobayashi, Hideki; Kumagai, Tomo'omi; Tei, Shunsuke; Pungga, Runi Anak Sylvester; Yamada, Taizo; Kameda, Akihiro; Yanagisawa, Masayuki; Nasahara, Kenlo Nishida; Muraoka, Hiroyuki; Ichii, Kazuhito; Tokumoto, Yuji",Perspective: Improving the accuracy of plant phenology observations and land-cover and land-use detection by optical satellite remote-sensing in the Asian tropics,FRONTIERS IN FORESTS AND GLOBAL CHANGE,,,10.3389/ffgc.2023.1106723,,"Recent advances in satellite-borne optical sensors led to important developments in the monitoring of tropical ecosystems in Asia, which have been strongly affected by recent anthropogenic activities and climate change. Based on our feasibility analyses conducted in Indonesia in Sumatra and Sarawak, Malaysia in Borneo, we discuss the current situation, problems, recent improvements, and future tasks regarding plant phenology observations and land-cover and land-use detection. We found that the Multispectral Instrument (MSI) on board the Sentinel-2A/2B satellites with a 10-m spatial resolution and 5-day observational intervals could be used to monitor phenology among tree species. For the Advanced Himawari Imager (AHI) on board the Himawari-8 geostationary satellite with a 1,000-m spatial resolution and 10-min observational intervals, we found that the time-series in vegetation indices without gaps due to cloud contamination may be used to accurately detect the timing and patterns of phenology among tree species, although the spatial resolution of the sensor requires further improvement. We also found and validated that text and pictures with geolocation information published on the Internet, and historical field notes could be used for ground-truthing land cover and land use in the past and present time. The future development of both high frequency (<= 10 min) and high spatial resolution (<= 10 m) optical sensors aboard satellites is expected to dramatically improve our understanding of ecosystems in the tropical Asia.",22/02/2023,02/03/2025 20:24,02/03/2025 20:24,,,,,6,,,,,,,,,,English,,,,,,,"Place: AVENUE DU TRIBUNAL FEDERAL 34, LAUSANNE, CH-1015, SWITZERLAND Publisher: FRONTIERS MEDIA SA Type: Review",,,,cloud contamination; deforestation; general flowering event; geostationary satellite (GEO); optical sensor; Sarawak (Malaysia); Sumatra,,,,,,,,,,,,,,,,,,,,,,,,,,,,,,,,,,,,,,,,,,,,,,,
Q34XSFGJ,journalArticle,2000,"Sakai, S",Reproductive phenology of gingers in a lowland mixed dipterocarp forest in Borneo,JOURNAL OF TROPICAL ECOLOGY,,0266-4674,10.1017/S0266467400001449,,"Reproductive phenology of 117 individuals from a total of 20 ginger species (Costaceae and Zingiberaceae) was monitored for up to 21 mo in a lowland mixed dipterocarp forest in the Lambir Hills National Park, Sarawak. Of these 20 species of iteroparous perennials, pollinated by either spiderhunters (Nectariniidae), medium-sized Amegilla bees (Anthophoridae), or small halictid bees (Halictidae), many reproduced more than once a year, or flowered continuously with short interruptions. Significant hut weak synchronization in flowering events among conspecific individuals was detected for only two species out of the five examined (Etlingera aff. metriocheilos and Amomum somniculosum). The low synchronization within the population, the overlapping flowering among species sharing common pollinators, and the high flowering frequency for each species, contrast markedly with the reproductive phenology of hummingbird-pollinated and large bee-pollinated plants of related tars in the Neotropics. Although the plants studied do not include all members of each pollination guild, at least one species within a guild was flowering at any time except in the spiderhunter-pollinated guild. Some bee-pollinated gingers may serve as keystone species for survival of the traplining bees living on floral nectar and pollen.",2000-05,02/03/2025 20:24,02/03/2025 20:24,,337-354,,3,16,,,,,,,,,,English,,,,,,,"Place: 40 WEST 20TH STREET, NEW YORK, NY 10011-4211 USA Publisher: CAMBRIDGE UNIV PRESS Type: Article",,,,reproductive phenology; tropical forest; pollination; Costaceae; dipterocarp forest; Sarawak; understorey; Zingiberaceae,,,,,,,,,,,,,,,,,,,,,,,,,,,,,,,,,,,,,,,,,,,,,,,
CIN8AHF4,journalArticle,2007,"Inkrot, Daniela; Sattler, Dietmar; Geyer, Christian; Morawetz, Wilfried","Flowering and fruiting phenology of <i>Normanbya normanbyi</i> (W. Hill) L. H. !Bailey (Arecaceae), a palm endemic to the lowland tropical rainforest of north-eastern Australia",AUSTRAL ECOLOGY,,1442-9985,10.1111/j.1442-9993.2007.01737.x,,"Normanbya normanbyi (W. Hill) L. H. Bailey (Arecaceae) is a monoecious, arborescent palm with a very small distribution area within the Daintree rainforest in north-eastern Australia. Our 2-year study was focused on the reproductive phenology at the individual and population level. At the population level flowering peaked in the dry season, whereas fruiting was confined to the wet season. Each palm can bear up to three inflorescences/infructescences at the same time. Flowering of each inflorescence is separated from each other by a couple of weeks. A single inflorescence consists of about 1900 staminate and 800 pistillate flowers. The flowering of N. normanbyi is protandrous with a staminate phase lasting 40 days and a pistillate phase of approximately 2 weeks. Between both phases is a non-flowering phase of about 9 days. Fruit ripening takes 21 weeks, with an average of about 280 ripe fruit per tree. Comparison of three study plots revealed a moderate synchrony of flowering and fruiting initiation in this species of palm. The male phase of flowering shows a higher degree of synchrony than the female phase at the population level. Seasonal regularity of flowering and fruiting peaks appears to be predictable. The general flowering and fruiting phenology of N. normanbyi follows a subannual pattern with a strong tendency towards a continual pattern.",2007-02,02/03/2025 20:24,02/03/2025 20:24,,21-28,,1,32,,,,,,,,,,English,,,,,,,"Place: 9600 GARSINGTON RD, OXFORD OX4 2DQ, OXON, ENGLAND Publisher: BLACKWELL PUBLISHING Type: Article",,,,phenology; Australia; Arecaceae; flowering and fruiting synchrony; Normanbya normanbyi; tropical forest canopies,,,,,,,,,,,,,,,,,,,,,,,,,,,,,,,,,,,,,,,,,,,,,,,
HGV6FFM4,journalArticle,2021,"de Oliveira, Carolina Santos; de Sousa Messeder, Joao Vitor; Teixido, Alberto Lopez; Reis Arantes, Marcel Rozemberg; Oliveira Silveira, Fernando Augusto",Vegetative and reproductive phenology in a tropical grassland-savanna-forest gradient,JOURNAL OF VEGETATION SCIENCE,,1100-9233,10.1111/jvs.12997,,"Question Climate, particularly precipitation, is the primary factor driving tropical plant phenology because of its relevant role in regulating water availability. However, differences in soil physicochemical properties can also drive resource availability, potentially affecting plant phenology, especially under similar environments in terms of rainfall regime. We determined whether the seasonality and synchrony of the vegetative and reproductive phenophases differ along a grassland-savanna-forest gradient under the same climate regime in a Neotropical seasonal ecosystem. We hypothesized that species growing on shallow, nutrient-impoverished soils have a higher capacity to respond to precipitation pulses than those on rich soils. Location Serra do Cipo, southeastern Brazil. Methods We quantified soil physicochemical properties associated with fertility and water retention of the grassland (campo rupestre), savanna (cerrado) and forest, and determined the phenological strategies of 70 species across the three vegetation types by monitoring vegetative and reproductive phenophases over one year. For each phenophase, in each vegetation type, we evaluated the seasonality and synchrony of phenological patterns. We quantified the phylogenetic signal for phenophases to disentangle the relative roles of historical vs ecological drivers of plant phenology. Results Soils from campo rupestre were more nutrient- and water-limited than those of cerrado and forest. Cerrado and forest communities had similar phenological strategies, whereas species from campo rupestre showed strategies that maximize resource acquisition and conservation. In the cerrado and forest, leafing and flowering patterns were seasonal, with leaf flushing and flowering peaking at the onset of the rainy season and leaf senescence in the dry season. Conversely, species from campo rupestre showed continuous leafing and flowering patterns, while fruiting was seasonal. Phenophases did not show a phylogenetic signal. Conclusions We demonstrated changes in vegetative and reproductive phenology that are likely associated with variations in soil physicochemical properties. We argue that more severe edaphic filters may have shaped different phenological patterns in campo rupestre.",2021-03,02/03/2025 20:24,02/03/2025 20:24,,,,2,32,,,,,,,,,,English,,,,,,,"Place: 111 RIVER ST, HOBOKEN 07030-5774, NJ USA Publisher: WILEY Type: Article",,,,seasonality; campo rupestre; cerrado; environmental gradients; forest; phenological strategy; soil physicochemical properties; vegetative and reproductive phenophases,,,,,,,,,,,,,,,,,,,,,,,,,,,,,,,,,,,,,,,,,,,,,,,
CACJMKCS,journalArticle,2012,"Cardoso, F. C. G.; Marques, R.; Botosso, P. C.; Marques, M. C. M.",Stem growth and phenology of two tropical trees in contrasting soil conditions,PLANT AND SOIL,,0032-079X,10.1007/s11104-011-1063-9,,"Phenological variations in tropical forests are usually explained by climate. Nevertheless, considering that soil water availability and nutrient content also influence plant water status and metabolism, soil conditions may also be important in the regulation of plant reproductive and vegetative activities over time. We investigated whether phenological patterns and stem growth differ in trees growing in two types of soil that display contrasting water and nutrient availability, namely, Gleysol (moist and nutrient-poor) and Cambisol (drier and nutrient-rich). Phenological observations (flushing, leaf fall, flowering and fruiting) and stem diameter growth were recorded for 120 trees fitted with fixed dendrometer bands, at 15 days intervals, for 1 year. Two species of contrasting deciduousness were investigated: Senna multijuga (semi-deciduous) and Citharexylum myrianthum (deciduous). Both species were seasonal in all phenophases, regardless of soil type. However, frequency, mean date and intensity of phenophases varied according to soil type. Girth increment of C. myrianthum was four times greater in Cambisol than in Gleysol, whereas the type of soil had no significant effect on that of S. multijuga. These results show that soil characteristics also play an important role in determining phenological patterns and growth and must be considered when analysing phenological patterns in tropical forests.",2012-05,02/03/2025 20:24,02/03/2025 20:24,,269-281,,01-Feb,354,,,,,,,,,,English,,,,,,,"Place: VAN GODEWIJCKSTRAAT 30, 3311 GZ DORDRECHT, NETHERLANDS Publisher: SPRINGER Type: Article",,,,Tropical forest; Citharexylum myrianthum; Diameter growth; Seasonal rhythms; Senna multijuga; Soil nutrients,,,,,,,,,,,,,,,,,,,,,,,,,,,,,,,,,,,,,,,,,,,,,,,
2US5GNYY,journalArticle,2005,"McLaren, KP; McDonald, MA",Seasonal patterns of flowering and fruiting in a dry tropical forest in Jamaica,BIOTROPICA,,0006-3606,10.1111/j.1744-7429.2005.00075.x,,"Tropical dry forests occupy more area and are more endangered than rainforests, yet their regeneration ecology has received less study and is consequently poorly understood. We recorded the flowering and fruiting phenology of a tropical dry forest in Jamaica over a period of 26 mo within ten 15 x 15-m plots. Community-wide recruitment reached a maximum in the wet season, whereas no recruitment occurred during the dry season. We observed a unimodal peak in rainfall and fruit production, and the periodicity and intensity of seed production were significantly correlated with rainfall seasonality (the optimal time for germination). Flowering at the community and system levels lagged behind a significant increase and subsequent decrease in rainfall by 7 and 3 mo, respectively, indicating that the dominant factor controlling flowering periodicity is the passage of the major (4-mo long) rainy season and changes in soil moisture conditions. Fruiting lagged behind flowering by 2 mo and a significant increase in fruiting occurred 2 mo prior to a significant increase in rainfall. At the population level, a correspondence analysis identified a major dichotomy in the patterns of flowering and fruiting between species and indicated two broad species groups based oil their time of peak fruiting and the number of times they were in fruit. These were either individuals which were usually in peak fruit 1-2 mo prior to the start of the major rainy season or those that were in fruit more or less continuously throughout the year with no peak fruiting time. This study supports the view that seasonal variation in rainfall and hence soil water availability constitutes both the proximate and the ultimate cause of flowering periodicity in tropical dry forests.",2005-12,02/03/2025 20:24,02/03/2025 20:24,,584-590,,4,37,,,,,,,,,,English,,,,,,,"Place: 111 RIVER ST, HOBOKEN 07030-5774, NJ USA Publisher: WILEY Type: Article",,,,dry season; flowering; fruiting; phenology; disturbance; tropical dry forest,,,,,,,,,,,,,,,,,,,,,,,,,,,,,,,,,,,,,,,,,,,,,,,
A5S6J98C,journalArticle,2017,"Cortes-Flores, Jorge; Beatriz Hernandez-Esquivel, Karen; Gonzalez-Rodriguez, Antonio; Ibarra-Manriquez, Guillermo","Flowering phenology, growth forms, and pollination syndromes in tropical dry forest species: Influence of phylogeny and abiotic factors",AMERICAN JOURNAL OF BOTANY,,0002-9122,10.3732/ajb.1600305,,"PREMISE OF THE STUDY: Analyses of the influence of temporal variation in abiotic factors on flowering phenology of tropical dry forest species have not considered the possible response of species with different growth forms and pollination syndromes, while controlling for phylogenetic relationships among species. Here, we investigated the relationship between flowering phenology, abiotic factors, and plant functional attributes, while controlling for phylogenetic relationship among species, in a dry forest community in Mexico. METHODS: We characterized flowering phenology (time and duration) and pollination syndromes of 55 tree species, 49 herbs, 24 shrubs, 15 lianas, and 11 vines. We tested the influence of pollination syndrome, growth form, and abiotic factors on flowering phenology using phylogenetic generalized least squares. KEY RESULTS: We found a relationship between flowering duration and time. Growth form was related to flowering time, and the pollination syndrome had a more significant relationship with flowering duration. Flowering time variation in the community was explained mainly by abiotic variables, without an important phylogenetic effect. Flowering time in lianas and trees was negatively and positively correlated with daylength, respectively. CONCLUSIONS: Functional attributes, environmental cues, and phylogeny interact with each other to shape the diversity of flowering patterns. Phenological differentiation among species groups revealed multiples strategies associated with growth form and pollination syndromes that can be important for understanding species coexistence in this highly diverse plant community.",2017-01,02/03/2025 20:24,02/03/2025 20:24,,39-49,,1,104,,,,,,,,,,English,,,,,,,"Place: 111 RIVER ST, HOBOKEN 07030-5774, NJ USA Publisher: WILEY Type: Article",,,,flowering duration; phylogenetic signal; Balsas River Basin; flowering time,,,,,,,,,,,,,,,,,,,,,,,,,,,,,,,,,,,,,,,,,,,,,,,
EJ7JL6BX,journalArticle,2004,"Borchert, R; Meyer, SA; Felger, RS; Porter-Bolland, L",Environmental control of flowering periodicity in Costa Rican and Mexican tropical dry forests,GLOBAL ECOLOGY AND BIOGEOGRAPHY,,0960-7447,10.1111/j.1466-822X.2004.00111.x,,"Aim We analyse the proximate causes of the large variation in flowering periodicity among four tropical dry forests (TDF) and ask whether climatic periodicity or biotic interactions are the ultimate causes of flowering periodicity. Location The four TDFs in Guanacaste (Costa Rica), Yucatan, Jalisco and Sonora (Mexico) are characterized by a 5-7 month long dry season and are located along a gradient of increasing latitude (10-30degreesN). Methods To dissect the differences in flowering periodicity observed at the community level, individual tree species were assigned to `flowering types', i.e. groups of species with characteristic flowering periods determined by similar combinations of environmental flowering cues and vegetative phenology. Results Large variation in the fraction of species and flowering types blooming during the dry and wet season, respectively, indicates large differences in the severity of seasonal drought among the four forests. In the dry upland forests of Jalisco, flowering of leafless trees remains suppressed during severe seasonal drought and is triggered by the first rains of the wet season. In the other forests, leaf shedding, exceptional rainfall or increasing daylength cause flowering of many deciduous species at various times during the dry season, well before the summer rains. The fraction of deciduous species leafing out during the summer rains and flowering when leafless during the dry season is largest in the Sonoran TDF. Main conclusions In many wide-ranging species the phenotypic plasticity of flowering periodicity is large. The distinct temporal separation of spring flowering on leafless shoots and subsequent summer flushing represents a unique adaptation of tree development to climates with a relatively short rainy season and a long dry season. Seasonal variation in rainfall and soil water availability apparently constitutes not only the proximate, but also the ultimate cause of flowering periodicity, which is unlikely to have evolved in response to biotic adaptive pressures.",2004-09,02/03/2025 20:24,02/03/2025 20:24,,409-425,,5,13,,,,,,,,,,English,,,,,,,"Place: 9600 GARSINGTON RD, OXFORD OX4 2DG, OXON, ENGLAND Publisher: BLACKWELL PUBLISHING LTD Type: Article",,,,Costa Rica; flower induction; flowering phenology; Mexico; photoperiodic control; rainfall periodicity; tropical deciduous forest; tropical tree phenology,,,,,,,,,,,,,,,,,,,,,,,,,,,,,,,,,,,,,,,,,,,,,,,
8PTYQZNN,journalArticle,2018,"Lima, Joanna M. Tucker; Caruso, Nicholas M.; Clugston, James; Kainer, Karen A.",Landscape change alters reproductive phenology and sex expression in <i>Attalea</i> palms (Arecaceae) of southwestern Amazonia,PLANT ECOLOGY,,1385-0237,10.1007/s11258-018-0874-7,,"As deforestation and land-use/land-cover change advance in tropical forest regions, an understanding of how plants adjust phenology and reproductive dynamics to altered landscapes can provide insights into plasticity, productivity, and population persistence. We compared the reproductive phenology, sex expression, and flower and fruit production of two monoecious Amazonian palms, Attalea phalerata and Attalea speciosa, in old-growth forest and as remnant trees growing in actively grazed pastures. Using 2 years of phenology data collected from natural populations near Vila Extrema, Rondonia, and eastern Acre, Brazil, we compared flowering and fruiting in the two habitats and tested for effects of palm height, crown size, and light availability on inflorescence and sex expression. Forest conversion to pasture stimulated greater overall flowering and fruiting in individual Attalea palms. As a population, remnant pasture palms continuously bore flowers and fruits year-round, while forest palms flowered seasonally in isolated peaks with consecutive months of inactivity. Crown size and greater light exposure affected flowering and fruiting dynamics in A. phalerata and A. speciosa, respectively, and increased light availability shifted A. speciosa sex expression towards greater female investment, primarily through regulation of sex determination and bud abortion. Removal of tropical forest does not always lead to the downfall of remnant tree populations, and under favorable conditions, such as abandonment of cropland and pasture, higher levels of reproduction can facilitate recovery of future generations. Tree species with flexible sex expression may be particularly resilient in the face of land-use and land-cover change.",2018-10,02/03/2025 20:24,02/03/2025 20:24,,1225-1245,,10,219,,,,,,,,,,English,,,,,,,"Place: VAN GODEWIJCKSTRAAT 30, 3311 GZ DORDRECHT, NETHERLANDS Publisher: SPRINGER Type: Article",,,,Flowering; Attalea phalerata; Attalea speciosa; Remnant trees; Reproductive biology; Tropical rain forest,,,,,,,,,,,,,,,,,,,,,,,,,,,,,,,,,,,,,,,,,,,,,,,
